,Job_Title,Job_Description,Industry,Sector,target,clean_text
39,Integration Business Analyst,"Peloton's IT organization is seeking an experienced Systems/Business Analyst to assist in implementing and supporting our data integrations points. In this role, you will work with stakeholders to understand business requirements, gather information about various source systems, and develop documentation which connects our data sources together. You are able to work in a fast-paced environment to manage competing priorities, meet agreed-upon deadlines, and deliver high-quality work.
This role offers a unique opportunity to be a part of an evolving IT organization, a results-oriented and driven global organization with ownership over a portfolio that delivers direct value to these organizational stakeholders and Peloton overall. The ideal profile of this position calls for a flexible and well-rounded individual - someone who is self-motivated, detailed oriented, collaborative and has strong communication skills.
Who you are:
Function as a technical business analyst by understanding business requirements and transforming those requirements into data mapping specs.
Understand the full end-to-end impacts of an initiative and have the ability to identify any impacts to other cross-functional teams/applications that also work on production issue resolutions.
You can articulate complex concepts in a way that is understandable to non-technical stakeholders;
You have excellent analytical and critical reasoning skills;
You are a proactive problem-solver, even in areas of uncertainty and ambiguity;
You possess strong collaboration skills and approach problems with positive intent while driving towards resolution;
Job Responsibilities
Monitor, troubleshoot, and resolve problems with Boomi integrations.
Collaborate with the development team to architect efficient and stable integrations
Document and analyze current business processes and underlying systems/applications
Lead the research, development & implementation of special projects, as needed;
Provide guidance on the monitoring, troubleshooting, and resolution of support issues in collaboration with the appropriate stakeholders.
Communicate and collaborate effectively with technical peers and business users
Basic Job Requirements
Bachelor's degree
Strong verbal and written communication skills
Strong analytical and critical thinking skills
Adept and proactive at problem-solving and conflict resolution
Minimum of 3 years experience working with Data Integration teams.
Worked with teams at least 2 to 3 full integration projects involving on-premise and Cloud applications
Functional experience with ERP systems (i.e. NetSuite,SAP)
SQL language proficiency with at least one of the common database platforms such as SQL Server, Oracle, MySQL, and/or DB2 database management systems
Ability to work well under pressure; manage tight deadlines and situations where conflicting priorities arise
Preferred Experience
Strong understanding of integration architecture options such as SoA and APIs
Experience working with any Job Scheduling tool (i.e. Control M, JAMS)
Functional experience with ERP systems (i.e. NetSuite, SAP)
Hands-on experience on Integration Platforms such as Boomi, MuleSoft; AnyPoint, Pentaho, and Informatica
ABOUT PELOTON:
Founded in 2012, Peloton is a global interactive fitness platform that brings the energy and benefits of studio-style workouts to the convenience and comfort of home. We use technology and design to bring our Members immersive content through the Peloton Bike, the Peloton Tread, and Peloton Digital, which provide comprehensive, socially-connected fitness offerings anytime, anywhere. We believe in taking risks and challenging the status quo by continuously innovating and improving. Our team is made up of passionate brand ambassadors, and we know that together, we go far.
Headquartered in New York City, with offices, warehouses and retail showrooms in the US, UK and Canada, Peloton is changing the way people get fit. Peloton has been named to many prestigious industry lists, including Fast Company's Most Innovative Companies, CNBC's Disruptor 50, Crain's New York Business' Tech25 and Fast50, as well as TIME's Genius Companies. Visit to learn more about joining our team.","Health, Beauty, & Fitness",Consumer Services,Consumer Services,peloton s it organization is seeking an experienced systems business analyst to assist in implementing and supporting our data integrations points in this role you will work with stakeholders to understand business requirements gather information about various source systems and develop documentation which connects our data sources together you are able to work in a fast paced environment to manage competing priorities meet agreed upon deadlines and deliver high quality work this role offers a unique opportunity to be a part of an evolving it organization a results oriented and driven global organization with ownership over a portfolio that delivers direct value to these organizational stakeholders and peloton overall the ideal profile of this position calls for a flexible and well rounded individual someone who is self motivated detailed oriented collaborative and has strong communication skills who you are function as a technical business analyst by understanding business requirements and transforming those requirements into data mapping specs understand the full end to end impacts of an initiative and have the ability to identify any impacts to other cross functional teams applications that also work on production issue resolutions you can articulate complex concepts in a way that is understandable to non technical stakeholders you have excellent analytical and critical reasoning skills you are a proactive problem solver even in areas of uncertainty and ambiguity you possess strong collaboration skills and approach problems with positive intent while driving towards resolution job responsibilities monitor troubleshoot and resolve problems with boomi integrations collaborate with the development team to architect efficient and stable integrations document and analyze current business processes and underlying systems applications lead the research development implementation of special projects as needed provide guidance on the monitoring troubleshooting and resolution of support issues in collaboration with the appropriate stakeholders communicate and collaborate effectively with technical peers and business users basic job requirements bachelor s degree strong verbal and written communication skills strong analytical and critical thinking skills adept and proactive at problem solving and conflict resolution minimum of 3 years experience working with data integration teams worked with teams at least 2 to 3 full integration projects involving on premise and cloud applications functional experience with erp systems i e netsuite sap sql language proficiency with at least one of the common database platforms such as sql server oracle mysql and or db2 database management systems ability to work well under pressure manage tight deadlines and situations where conflicting priorities arise preferred experience strong understanding of integration architecture options such as soa and apis experience working with any job scheduling tool i e control m jams functional experience with erp systems i e netsuite sap hands on experience on integration platforms such as boomi mulesoft anypoint pentaho and informatica about peloton founded in 2012 peloton is a global interactive fitness platform that brings the energy and benefits of studio style workouts to the convenience and comfort of home we use technology and design to bring our members immersive content through the peloton bike the peloton tread and peloton digital which provide comprehensive socially connected fitness offerings anytime anywhere we believe in taking risks and challenging the status quo by continuously innovating and improving our team is made up of passionate brand ambassadors and we know that together we go far headquartered in new york city with offices warehouses and retail showrooms in the us uk and canada peloton is changing the way people get fit peloton has been named to many prestigious industry lists including fast company s most innovative companies cnbc s disruptor 50 crain s new york business tech25 and fast50 as well as time s genius companies visit to learn more about joining our team
40,BSA Analyst III,"Provident Bank, a multi-billion dollar NJ bank with branches in NJ and eastern PA, has opportunities for experiences BSA/AML Analysts based in our Iselin, NJ offices. Candidates must have a minimum of five years BSA/AML experience that includes through knowledge of all related regulations, experience using databases and website utilized in investigations of fraudulent activity.

We offer a competitive compensation package that includes medical/dental/life insurances, 401(k) with match, Exployee Stock Ownership Pan, student loan paydown program, generous paid time off and more!

POSITION SUMMARY

Under general direction, this individual contributor ensures compliance with the Bank Secrecy Act (BSA), Anti-Money Laundering (AML) regulations, the USA PATRIOT Act, Know Your Customer (KYC) requirements, Office of Foreign Asset Control (OFAC) regulations, Customer Identification Program (CIP) requirements and Provident Bank's policies and procedures (hereafter referred to as the ""BSA Program""). This position is a senior level in the job family. Incumbent is expected to display professional maturity, judgment and experience. A certain level of creativity, diplomacy and latitude is expected. Incumbent is expected to train less experienced staff members.

MAJOR JOB RESPONSIBILITIES
Contributes to Alert Clearing and Case Management processes. Reviews assigned alerts to determine if the activity is consistent with the expected customer behavior or is unusual for the customerÄôs risk profile and warrants further investigation. Creates cases to conduct a thorough investigation of the unusual/potentially suspicious activity inclusive of analysis of the collected data and customer due diligence, documenting the investigation results and providing initial recommendations with supporting conclusion to BSA Management, all, within a timely manner. Writes Suspicious Activity Report (SAR) narrative draft and compiles SAR administrative elements in accordance to internal and regulatory deadlines. Makes recommendations as to account product changes, replacements or closeouts, and/or restrictions based upon investigation results. Assists BSA Management in the review and determination of BSA/AML investigations.

50%
Conducts periodic enhanced due diligence reviews and annual exempt customer reviews to identify activity that may not align with the business nature/industry and/or customer due diligence profile. Analyzes customer behavior and activity patterns of low, medium, and high-risk customers to determine if custom settings need to be applied.

20%
Monitoring the Bank's overall compliance with the BSA Program including monitoring and investigating OFAC concerns. Assisting in the timely research of and response to 314a Requests to ensure the BankÄôs compliance with FinCENÄôs noted deadlines. Recommends changes to the Bank's BSA Program and/or account opening policies and procedures.

10%
Conducts face-to-face training sessions on the requirements of Bank's BSA Program. Provides guidance and support to personnel regarding the BSA Program and the Bank's policies and procedures. Develops a subject matter knowledge of the BankÄôs Lending and Wealth Management products and processes to provide guidance and assistance in BSA/AML investigations.

10%
Performs related duties as required that may include but are not limited to:
Serving as a regional liaison to frontline personnel for providing guidance and troubleshooting BSA-related issues, concern and initiatives;
Monitoring cash sales of monetary instruments for suspicious activity. Monitoring logging of cash sales of monetary instruments to the BankÄôs Monetary Instrument Log (MIL) to ensure all transactions subject to the Bank Secrecy ActÄôs recordkeeping requirements are captured;
Responding to law enforcement requests for supporting SAR documentation;
Conducting Customer Due Diligence inclusive of customer meetings and/or site visits due to abnormal or suspicious activity that would require further analysis based on risk categories and customer profiles. Conducting periodic Check Casher Reviews;
Keeping informed of laws, regulations, and current practices pertaining to the Bank Secrecy Act and Anti-Money Laundering regulations to assist in maintaining a risk based BSA/AML and OFAC compliance program;
Working closely with team members and BSA Management to reach departmental goals; and
Participating in Bank projects specific to and/or outside of BSA Compliance, providing a compliance perspective/awareness. Identifying and communicating any risk that may be associated with the project and/or its implementation.
10%

SUPERVISORY RESPONSIBILITIES

No direct responsibilities; however, provides guidance to less experienced personnel regarding banking and BSA/AML requirements in absence of BSA/AML Management.

SKILLS AND TRAINING
Knowledge of the BSA, AML, USA PATRIOT Act, KYC, and OFAC regulations.
Knowledge of databases and websites used in the investigations of suspicious activity, including money laundering and terrorist financing.
Knowledge of banking and branch operations.
Good personal computer skill and proficient in using software commonly employed in an office environment.
Excellent written, oral communication and presentation skills.
Ability to analyze business situations, identify problems or concerns, determine applicable scenarios and choose the appropriate solution to the problem.
Interacts with other Bank personnel to obtain customer information for use in suspicious activity investigations.
EDUCATION

BachelorÄôs degree

WORK EXPERIENCE

5 or more years related within financial services industry

LICENSES AND/OR CERTIFICATES

Licenses and Certifications Expiration Date

ACAMS (Preferred; Not Required)

WORKING CONDITIONS

Work is performed in a normal office environment however work may be performed in all areas of the Bank. May include travel by automobile.

HAZARDS

The hazards are mainly those present in a normal office setting, and those present in commuting by car.

This job description may not be all-inclusive. Employees are expected to perform other duties as assigned and directed by management. Job descriptions and duties may be modified when deemed appropriate by management.",Banks & Credit Unions,Finance,Finance,provident bank a multi billion dollar nj bank with branches in nj and eastern pa has opportunities for experiences bsa aml analysts based in our iselin nj offices candidates must have a minimum of five years bsa aml experience that includes through knowledge of all related regulations experience using databases and website utilized in investigations of fraudulent activity we offer a competitive compensation package that includes medical dental life insurances 401 k with match exployee stock ownership pan student loan paydown program generous paid time off and more position summary under general direction this individual contributor ensures compliance with the bank secrecy act bsa anti money laundering aml regulations the usa patriot act know your customer kyc requirements office of foreign asset control ofac regulations customer identification program cip requirements and provident bank s policies and procedures hereafter referred to as the bsa program this position is a senior level in the job family incumbent is expected to display professional maturity judgment and experience a certain level of creativity diplomacy and latitude is expected incumbent is expected to train less experienced staff members major job responsibilities contributes to alert clearing and case management processes reviews assigned alerts to determine if the activity is consistent with the expected customer behavior or is unusual for the customeräôs risk profile and warrants further investigation creates cases to conduct a thorough investigation of the unusual potentially suspicious activity inclusive of analysis of the collected data and customer due diligence documenting the investigation results and providing initial recommendations with supporting conclusion to bsa management all within a timely manner writes suspicious activity report sar narrative draft and compiles sar administrative elements in accordance to internal and regulatory deadlines makes recommendations as to account product changes replacements or closeouts and or restrictions based upon investigation results assists bsa management in the review and determination of bsa aml investigations 50 conducts periodic enhanced due diligence reviews and annual exempt customer reviews to identify activity that may not align with the business nature industry and or customer due diligence profile analyzes customer behavior and activity patterns of low medium and high risk customers to determine if custom settings need to be applied 20 monitoring the bank s overall compliance with the bsa program including monitoring and investigating ofac concerns assisting in the timely research of and response to 314a requests to ensure the bankäôs compliance with fincenäôs noted deadlines recommends changes to the bank s bsa program and or account opening policies and procedures 10 conducts face to face training sessions on the requirements of bank s bsa program provides guidance and support to personnel regarding the bsa program and the bank s policies and procedures develops a subject matter knowledge of the bankäôs lending and wealth management products and processes to provide guidance and assistance in bsa aml investigations 10 performs related duties as required that may include but are not limited to serving as a regional liaison to frontline personnel for providing guidance and troubleshooting bsa related issues concern and initiatives monitoring cash sales of monetary instruments for suspicious activity monitoring logging of cash sales of monetary instruments to the bankäôs monetary instrument log mil to ensure all transactions subject to the bank secrecy actäôs recordkeeping requirements are captured responding to law enforcement requests for supporting sar documentation conducting customer due diligence inclusive of customer meetings and or site visits due to abnormal or suspicious activity that would require further analysis based on risk categories and customer profiles conducting periodic check casher reviews keeping informed of laws regulations and current practices pertaining to the bank secrecy act and anti money laundering regulations to assist in maintaining a risk based bsa aml and ofac compliance program working closely with team members and bsa management to reach departmental goals and participating in bank projects specific to and or outside of bsa compliance providing a compliance perspective awareness identifying and communicating any risk that may be associated with the project and or its implementation 10 supervisory responsibilities no direct responsibilities however provides guidance to less experienced personnel regarding banking and bsa aml requirements in absence of bsa aml management skills and training knowledge of the bsa aml usa patriot act kyc and ofac regulations knowledge of databases and websites used in the investigations of suspicious activity including money laundering and terrorist financing knowledge of banking and branch operations good personal computer skill and proficient in using software commonly employed in an office environment excellent written oral communication and presentation skills ability to analyze business situations identify problems or concerns determine applicable scenarios and choose the appropriate solution to the problem interacts with other bank personnel to obtain customer information for use in suspicious activity investigations education bacheloräôs degree work experience 5 or more years related within financial services industry licenses and or certificates licenses and certifications expiration date acams preferred not required working conditions work is performed in a normal office environment however work may be performed in all areas of the bank may include travel by automobile hazards the hazards are mainly those present in a normal office setting and those present in commuting by car this job description may not be all inclusive employees are expected to perform other duties as assigned and directed by management job descriptions and duties may be modified when deemed appropriate by management
