,Job_Title,Job_Description,Industry,Sector,target,clean_text
0,Business Analyst - Clinical & Logistics Platform,"Company Overview


At Memorial Sloan Kettering (MSK), weÄôre not only changing the way we treat cancer, but also the way the world thinks about it. By working together and pushing forward with innovation and discovery, weÄôre driving excellence and improving outcomes. For the 28th year, MSK has been named a top hospital for cancer by U.S. News & World Report. We are proud to be on BeckerÄôs Healthcare list as one of the 150 Great Places to Work in Healthcare in 2018, as well as one of GlassdoorÄôs EmployeesÄô Choice Best Place to Work for 2018. WeÄôre treating cancer, one patient at a time. Join us and make a difference every day.

Job Description


We are excited to recruit two Business Analyst(s) to join our digital, informatics and technology organization who will measure success on our high priority platforms supported by the Division of Health Informatics. DHI focuses on the interaction of people, processes, and technology enabling MSK to meet critical patient care and research objectives. Our division manages a suite of clinical information systems including the electronic health record, ancillary systems and other core components that enable decision support, health information exchange and knowledge management.

About the Clinical and Logistics Platform:MSK has committed to transforming itself into a digital organization. To help advance the transformation, MSK has committed to the Scaled Agile Framework (SAFe) as a method of managing technology work. As part of our digital transformation, MSK has identified a set of platforms that it will be creating to advance its digital transformation.

One of these high priority platforms is the Clinical and Logistics Platform, which is part of MSKÄôs digital ecosystem. The focus of the Clinical and Logistics Platform is to enable our Care Teams and Health Care Providers with a pre-integrated platform comprising of all our clinical, logistics, and communication systems. We aim to provide a world-class user experience, reduce friction and burnout to our Care Teams, and empower the Care Team members to provide the best patient experience.

You will:
Support agile team in translating end user requirements into set of user product criteria for technical development team & developing documentation
Connect with team to confirm product commitments
Conduct data analysis and research required for development team to make decisions
Collaborate with team to understand, analyze, document, and communicate platform requirements
Partner with key stakeholders to articulate and refine product vision throughout the iteration process
Help design team in translating product needs/requirements into deliverable units of work
Able to synthesize metrics such as: user satisfaction/adoption, quality of products delivered, time-to-market, timely delivery etc.
Collaborates closely with agile teams to translate business requirements and operational metrics between user groups and developers
Provide definitions for product criteria, readiness, completeness etc.
You have:
2-4 years of experience in a healthcare setting in a role such as data/business analysis
Bachelor's degree in Health Informatics, Computer Science, Information Systems or related
SAFe certification or exposure to agile methodologies a strong plus
Strong problem-solving and analytical skills, with ability to synthesize user needs and pull insights out of data
Excellent communicator able to negotiate with business to clarify needs vs. wants/likes to balance with development cost and risk
Ability to break down and describe business needs into work supporting an iterative and incremental delivery model
Credibility with both business leaders, product designers, & developers
#LI-POST

Benefits

Competitive compensation packages | Sick Time | Generous Vacation + 12 holidays to recharge & refuel | Internal Career Mobility & Performance Consulting | Medical, Dental, Vision, FSA & Dependent Care | 403b retirement savings plan match | Tuition Reimbursement | Parental Leave & Adoption Assistance | Commuter Spending Account | Fitness Discounts & Wellness Program | Resource Networks | Life Insurance & Disability | Remote Flexibility

We believe in communication, transparency, and thinking beyond your 8-hour day @ MSK. ItÄôs important to us that you have a sense of impact, community, and work/life balance to be and feel your best.

Our Hiring Process

You read the ad, agree it sounds like a great fit & apply -> Talent Acquisition contacts you to schedule a phone interview (if your profile aligns)-> after speaking with the Talent Acquisition Specialist, you will connect with the Hiring Manager by phone or video call -> if your experience is a fit, you will move forward to an on-site visit or video call with the team -> post interview feedback -> ideally an offer! -> reference check & onboarding -> orientation & official welcome to MSK

MSK has been named a Best Place to Work in IT by Insider Pro & Computerworld, for the 2nd year in a row.

We look forward to meeting soon!

Closing


MSK is an equal opportunity and affirmative action employer committed to diversity and inclusion in all aspects of recruiting and employment. All qualified individuals are encouraged to apply and will receive consideration without regard to race, color, gender, gender identity or expression, sexual orientation, national origin, age, religion, creed, disability, veteran status or any other factor which cannot lawfully be used as a basis for an employment decision.

Federal law requires employers to provide reasonable accommodation to qualified individuals with disabilities. Please tell us if you require a reasonable accommodation to apply for a job or to perform your job. Examples of reasonable accommodation include making a change to the application process or work procedures, providing documents in an alternate format, using a sign language interpreter, or using specialized equipment.",Health Care Services & Hospitals,Health Care,Health Care,company overview at memorial sloan kettering msk weäôre not only changing the way we treat cancer but also the way the world thinks about it by working together and pushing forward with innovation and discovery weäôre driving excellence and improving outcomes for the 28th year msk has been named a top hospital for cancer by u s news world report we are proud to be on beckeräôs healthcare list as one of the 150 great places to work in healthcare in 2018 as well as one of glassdooräôs employeesäô choice best place to work for 2018 weäôre treating cancer one patient at a time join us and make a difference every day job description we are excited to recruit two business analyst s to join our digital informatics and technology organization who will measure success on our high priority platforms supported by the division of health informatics dhi focuses on the interaction of people processes and technology enabling msk to meet critical patient care and research objectives our division manages a suite of clinical information systems including the electronic health record ancillary systems and other core components that enable decision support health information exchange and knowledge management about the clinical and logistics platform msk has committed to transforming itself into a digital organization to help advance the transformation msk has committed to the scaled agile framework safe as a method of managing technology work as part of our digital transformation msk has identified a set of platforms that it will be creating to advance its digital transformation one of these high priority platforms is the clinical and logistics platform which is part of mskäôs digital ecosystem the focus of the clinical and logistics platform is to enable our care teams and health care providers with a pre integrated platform comprising of all our clinical logistics and communication systems we aim to provide a world class user experience reduce friction and burnout to our care teams and empower the care team members to provide the best patient experience you will support agile team in translating end user requirements into set of user product criteria for technical development team developing documentation connect with team to confirm product commitments conduct data analysis and research required for development team to make decisions collaborate with team to understand analyze document and communicate platform requirements partner with key stakeholders to articulate and refine product vision throughout the iteration process help design team in translating product needs requirements into deliverable units of work able to synthesize metrics such as user satisfaction adoption quality of products delivered time to market timely delivery etc collaborates closely with agile teams to translate business requirements and operational metrics between user groups and developers provide definitions for product criteria readiness completeness etc you have 2 4 years of experience in a healthcare setting in a role such as data business analysis bachelor s degree in health informatics computer science information systems or related safe certification or exposure to agile methodologies a strong plus strong problem solving and analytical skills with ability to synthesize user needs and pull insights out of data excellent communicator able to negotiate with business to clarify needs vs wants likes to balance with development cost and risk ability to break down and describe business needs into work supporting an iterative and incremental delivery model credibility with both business leaders product designers developers li post benefits competitive compensation packages sick time generous vacation 12 holidays to recharge refuel internal career mobility performance consulting medical dental vision fsa dependent care 403b retirement savings plan match tuition reimbursement parental leave adoption assistance commuter spending account fitness discounts wellness program resource networks life insurance disability remote flexibility we believe in communication transparency and thinking beyond your 8 hour day msk itäôs important to us that you have a sense of impact community and work life balance to be and feel your best our hiring process you read the ad agree it sounds like a great fit apply talent acquisition contacts you to schedule a phone interview if your profile aligns after speaking with the talent acquisition specialist you will connect with the hiring manager by phone or video call if your experience is a fit you will move forward to an on site visit or video call with the team post interview feedback ideally an offer reference check onboarding orientation official welcome to msk msk has been named a best place to work in it by insider pro computerworld for the 2nd year in a row we look forward to meeting soon closing msk is an equal opportunity and affirmative action employer committed to diversity and inclusion in all aspects of recruiting and employment all qualified individuals are encouraged to apply and will receive consideration without regard to race color gender gender identity or expression sexual orientation national origin age religion creed disability veteran status or any other factor which cannot lawfully be used as a basis for an employment decision federal law requires employers to provide reasonable accommodation to qualified individuals with disabilities please tell us if you require a reasonable accommodation to apply for a job or to perform your job examples of reasonable accommodation include making a change to the application process or work procedures providing documents in an alternate format using a sign language interpreter or using specialized equipment
1,Business Analyst,"We are seeking for an energetic and collaborative analyst with experience and passion to fill our Business Analyst position. In this role you will be responsible for leading our Data & Analytics function. This is a cross-functional role where you will work with various areas (Investor Relations, Portfolio Excellence, Human Resource and Business Development) collecting and analyzing financial and operational data of our Private Equity and Portfolio Companies. If you enjoy working in a highly collaborative, analytical, fast-paced and dynamic environment, this is the right opportunity for you!
The ideal candidate will be highly skilled in all aspects of data analytics, including mining, generation and visualization. The role is committed to transforming data into readable, goal-driven reports for investors and business leaders.
Position Summary
Essential Job Functions:
To be the Äòdata masterÄô for key IT platforms that collect financial, operating and contact management data across the portfolio of companies that Paine Schwartz owns and network of contacts
Responsible for the timeliness and integrity of data in CRM (Salesforce.com) and finance/operating data systems (iLevel) and likely other data in the future
Actively participate in innovative projects to improve the Data Quality or master Data Management within the FirmÄôs data ecosystem
Responsible for assisting with the maintenance and updating of core firm marketing material, as well as supporting the Investor Relations & Business Development functions on specific presentation workstreams
Will support the Human Capital, Investor Relations, Business Development and Portfolio Operations function with insightful and useful reporting and analysis from these systems
Will have a career path in the exciting Private Equity industry with options to progress into more Financial or other functional responsibilities
Candidate Requirement
Required Skills:
Excellent excel, database and PPT skills
Understanding of income statements, balance sheets and cash flow reports and how they tie together
Good people management skills, ability to follow-up and ensure data is received timely and correctly in a professional manner
Extreme attention to detail
Ability to take initiative and work independently, while demonstrating strong teamwork
Must be able to work in a fast-paced environment, manage time and priorities under pressure and meet deadlines
Specific Technology platform requirements:
Salesforce.com (experience with this specific CRM tool is heavily desired):
Create custom objects, design page layouts, adjust fields and create custom reports.
Ability to use Salesforce data loader and Conga reporting solutions
Understanding of Pardot or other email marketing software
ILEVEL (we donÄôt require experience with this specific portal/finance tool but experience with ERP and financial platforms is desired). Ability to map data from financial statements.
Qualifications:
Undergraduate degree, preferably finance, economics, business or accounting related
Minimum two years of experience in a professional business context involving data management, analysis and reporting",Venture Capital & Private Equity,Finance,Finance,we are seeking for an energetic and collaborative analyst with experience and passion to fill our business analyst position in this role you will be responsible for leading our data analytics function this is a cross functional role where you will work with various areas investor relations portfolio excellence human resource and business development collecting and analyzing financial and operational data of our private equity and portfolio companies if you enjoy working in a highly collaborative analytical fast paced and dynamic environment this is the right opportunity for you the ideal candidate will be highly skilled in all aspects of data analytics including mining generation and visualization the role is committed to transforming data into readable goal driven reports for investors and business leaders position summary essential job functions to be the äòdata masteräô for key it platforms that collect financial operating and contact management data across the portfolio of companies that paine schwartz owns and network of contacts responsible for the timeliness and integrity of data in crm salesforce com and finance operating data systems ilevel and likely other data in the future actively participate in innovative projects to improve the data quality or master data management within the firmäôs data ecosystem responsible for assisting with the maintenance and updating of core firm marketing material as well as supporting the investor relations business development functions on specific presentation workstreams will support the human capital investor relations business development and portfolio operations function with insightful and useful reporting and analysis from these systems will have a career path in the exciting private equity industry with options to progress into more financial or other functional responsibilities candidate requirement required skills excellent excel database and ppt skills understanding of income statements balance sheets and cash flow reports and how they tie together good people management skills ability to follow up and ensure data is received timely and correctly in a professional manner extreme attention to detail ability to take initiative and work independently while demonstrating strong teamwork must be able to work in a fast paced environment manage time and priorities under pressure and meet deadlines specific technology platform requirements salesforce com experience with this specific crm tool is heavily desired create custom objects design page layouts adjust fields and create custom reports ability to use salesforce data loader and conga reporting solutions understanding of pardot or other email marketing software ilevel we donäôt require experience with this specific portal finance tool but experience with erp and financial platforms is desired ability to map data from financial statements qualifications undergraduate degree preferably finance economics business or accounting related minimum two years of experience in a professional business context involving data management analysis and reporting
2,Data Analyst,"For more than a decade, Asembia has been working with specialty pharmacies, manufacturers, prescribers, payers and other industry stakeholders to develop solutions for the high-touch specialty pharmaceutical service model.Through collaborative programs, contracting initiatives, patient support hub services and innovative technology platforms, Asembia is committed to positively impacting the patient journey.

Asembia focuses on the specialty pharmacy segment and offers comprehensive hub services, pharmacy network management, group purchasing (GPO) services, innovative technology platforms and more.As a leading industry voice and advocate, Asembia is committed to bringing strategic channel management solutions, leading-edge products and high-touch services to the specialty pharmacy industry that help our customers optimize patient care and outcomes.

Primary Function:

The Technical Analystis responsible for implementing data solutions for varied data reporting needs and act as a Subject Matter Expert (SME) for technical data product offerings.

Job Scope and Major Responsibilities:

¬?Follow all policies and internal processes to ensure data programs and files are delivered in accordance with the provisions of the Health Insurance Portability and Accountability Act of 1996 and its implementing regulations, as amended (ÄúHIPAAÄù).

¬?Design, develop and validate data reporting solutions with minimum supervision

¬?Evaluate data and report findings for accuracy, completeness, per the data specifications.

¬?Responsible for monitoring file/data receipt per expected schedules. Identify/escalate/ resolve nonconformances.

¬?Meet data reporting schedules to external stakeholders/ parties for designated data programs.

¬?Seek and adopt best practices in data reporting, make recommendations for data processing improvements. Identify opportunities to improve the process and data accuracy.

¬?Provide ad hoc data analysis to internal and external parties as requested.

¬? Successful collaboration with other Asembia team members to attain a common goal.

Qualifications:

¬?BachelorÄôs Degree required. B.A./B.S. Information Systems or similar field preferred.

¬?Minimum 1 to 3 years of experience working in data analytics or Software Quality assurance Äì preference towards Prescription / pharmaceutical data.

¬?Must have a working knowledge of SQL.

¬?Advance level skills in developing solutions using SQL and SSIS preferred, not required.

¬?Must be detail oriented with the ability focus on complex processing steps.

¬?Proven track record with taking ownership in data analytics or Software QA analysis.

¬?Ability to manage multiple initiatives in a fast paced, dynamic environment.

¬?Strong self-starter with a sense of ownership.

¬?Excellent organizational and collaboration skills.

Asembia is committed to Equal Employment Opportunity (EEO) and to compliance with all Federal, State and local laws that prohibit employment discrimination on the basis of race, color, age, natural origin, ethnicity, religion, gender, pregnancy, marital status, sexual orientation, gender identity and expression, citizenship, genetic disposition, disability or veteran's status or any other classification protected by State/Federal laws.",Biotech & Pharmaceuticals,Biotech & Pharmaceuticals,Biotech & Pharmaceuticals,for more than a decade asembia has been working with specialty pharmacies manufacturers prescribers payers and other industry stakeholders to develop solutions for the high touch specialty pharmaceutical service model through collaborative programs contracting initiatives patient support hub services and innovative technology platforms asembia is committed to positively impacting the patient journey asembia focuses on the specialty pharmacy segment and offers comprehensive hub services pharmacy network management group purchasing gpo services innovative technology platforms and more as a leading industry voice and advocate asembia is committed to bringing strategic channel management solutions leading edge products and high touch services to the specialty pharmacy industry that help our customers optimize patient care and outcomes primary function the technical analystis responsible for implementing data solutions for varied data reporting needs and act as a subject matter expert sme for technical data product offerings job scope and major responsibilities ¬ follow all policies and internal processes to ensure data programs and files are delivered in accordance with the provisions of the health insurance portability and accountability act of 1996 and its implementing regulations as amended äúhipaaäù ¬ design develop and validate data reporting solutions with minimum supervision ¬ evaluate data and report findings for accuracy completeness per the data specifications ¬ responsible for monitoring file data receipt per expected schedules identify escalate resolve nonconformances ¬ meet data reporting schedules to external stakeholders parties for designated data programs ¬ seek and adopt best practices in data reporting make recommendations for data processing improvements identify opportunities to improve the process and data accuracy ¬ provide ad hoc data analysis to internal and external parties as requested ¬ successful collaboration with other asembia team members to attain a common goal qualifications ¬ bacheloräôs degree required b a b s information systems or similar field preferred ¬ minimum 1 to 3 years of experience working in data analytics or software quality assurance äì preference towards prescription pharmaceutical data ¬ must have a working knowledge of sql ¬ advance level skills in developing solutions using sql and ssis preferred not required ¬ must be detail oriented with the ability focus on complex processing steps ¬ proven track record with taking ownership in data analytics or software qa analysis ¬ ability to manage multiple initiatives in a fast paced dynamic environment ¬ strong self starter with a sense of ownership ¬ excellent organizational and collaboration skills asembia is committed to equal employment opportunity eeo and to compliance with all federal state and local laws that prohibit employment discrimination on the basis of race color age natural origin ethnicity religion gender pregnancy marital status sexual orientation gender identity and expression citizenship genetic disposition disability or veteran s status or any other classification protected by state federal laws
