,Job_Title,Job_Description,Industry,Sector,target,clean_text
18,Business Analyst,"About Us:

NYSTEC is a non-profit technology consulting company, advising agencies, organizations, institutions, and businesses since 1996. Were independent and vendor-neutral so we have our clients best interests at heart. At NYSTEC, we know that we succeed when individuals and teams flourish personally and professionally, so our benefits and perks support this mindset. Are you ready to contribute to our engaged workforce and deliver the NYSTEC Experience?

About the Role:

As a Business Analyst in the Health Systems Transformation practice, you will collaborate with team members to conceptualize, deliver, and support our clients through today's ever-changing healthcare landscape. NYSTEC is considered a trusted program advisor, providing subject matter expertise, and connecting the dots for our clients. Over the last five years, NYSTEC has consulted on some of the largest DOH initiatives and served in various roles across a multitude of New York State and New York City healthcare technology systems.

Serving as a Business Analyst, your day-to-day role as a NYSTEC consultant will include engagement of stakeholders, elicitation and prioritization of stakeholder requirements, research and assessment of the existing technology, performing data analysis, and supporting quality assurance operations across NYC public health registries.

Key Responsibilities

Support Project Manager in defining and prioritizing project tasks.
Research and document project landscape.
Conduct stakeholder engagement sessions to identify system and policy requirements.
Analyze and prioritize requirements and identify associated risks.
Develop, execute and manage software test plan with cases.
Develop system documentation and supporting artifacts.
Perform situation quality assurance on data sets.

About You:

Required Qualifications

Business analysis experience required, including full SDLC implementation experience, requirements elicitation and landscape analysis
Strong written and verbal communication skills
Healthcare experience
Experience working on collaborative, cross-functional teams

Preferred/Desired Qualifications

Business Analysis Certification a plus (PMI or IIBA)

Education and Experience

A minimum of a Bachelor's degree with at least 3 years of related experience in Business Analysis is required. An equivalent combination of advanced education, training, and experience will be considered.

If youre an effective communicator who enjoys working in complex and collaborative environments, utilizing your critical thinking and research skills to develop solutions for clients, providing support to customers, and have the required education, experience and skills, we want to hear from you.

It is NYSTEC's policy to provide equal employment opportunity (EEO) to all individuals, regardless of actual or perceived race, color, creed, religion, sex or gender (including pregnancy, childbirth and related medical conditions), gender identity or gender expression (including transgender status), age, national origin, ancestry, citizenship status, physical or mental disability, protected medical condition as defined by applicable state or local law, genetic information, military service and veteran status, sexual orientation, marital status, , or any other characteristic protected by local, state, or federal law and ordinances. NYSTEC is strongly committed to this policy and believes in the concept and spirit of the law.

Applicants must be currently authorized to work in the United States without the need for visa sponsorship now or in the future.

Learn More About NYSTEC www.nystec.com",Consulting,Business Services,Business Services,about us nystec is a non profit technology consulting company advising agencies organizations institutions and businesses since 1996 were independent and vendor neutral so we have our clients best interests at heart at nystec we know that we succeed when individuals and teams flourish personally and professionally so our benefits and perks support this mindset are you ready to contribute to our engaged workforce and deliver the nystec experience about the role as a business analyst in the health systems transformation practice you will collaborate with team members to conceptualize deliver and support our clients through today s ever changing healthcare landscape nystec is considered a trusted program advisor providing subject matter expertise and connecting the dots for our clients over the last five years nystec has consulted on some of the largest doh initiatives and served in various roles across a multitude of new york state and new york city healthcare technology systems serving as a business analyst your day to day role as a nystec consultant will include engagement of stakeholders elicitation and prioritization of stakeholder requirements research and assessment of the existing technology performing data analysis and supporting quality assurance operations across nyc public health registries key responsibilities support project manager in defining and prioritizing project tasks research and document project landscape conduct stakeholder engagement sessions to identify system and policy requirements analyze and prioritize requirements and identify associated risks develop execute and manage software test plan with cases develop system documentation and supporting artifacts perform situation quality assurance on data sets about you required qualifications business analysis experience required including full sdlc implementation experience requirements elicitation and landscape analysis strong written and verbal communication skills healthcare experience experience working on collaborative cross functional teams preferred desired qualifications business analysis certification a plus pmi or iiba education and experience a minimum of a bachelor s degree with at least 3 years of related experience in business analysis is required an equivalent combination of advanced education training and experience will be considered if youre an effective communicator who enjoys working in complex and collaborative environments utilizing your critical thinking and research skills to develop solutions for clients providing support to customers and have the required education experience and skills we want to hear from you it is nystec s policy to provide equal employment opportunity eeo to all individuals regardless of actual or perceived race color creed religion sex or gender including pregnancy childbirth and related medical conditions gender identity or gender expression including transgender status age national origin ancestry citizenship status physical or mental disability protected medical condition as defined by applicable state or local law genetic information military service and veteran status sexual orientation marital status or any other characteristic protected by local state or federal law and ordinances nystec is strongly committed to this policy and believes in the concept and spirit of the law applicants must be currently authorized to work in the united states without the need for visa sponsorship now or in the future learn more about nystec www nystec com
19,Business Intelligence Analyst,"About UsVenmo was founded on the principles of breaking down the intimidating barriers around financial transactions to make them intuitive, friendly, and even fun. And it worked: people love sending money with Venmo, and we're growing by leaps and bounds!But we're only just getting started. We want to take that magic of sending money with Venmo and cascade it into every place where people use money. That means connecting people to their money in the most intuitive and fun way possible, then connecting people with each other. Users already love Venmo, but we know there are lots of things we haven't thought of to make the experience of using Venmo even more delightful and valuable. All that's going to take a lot of figuring out. Let's figure it out together!Business Intelligence at VenmoWe are looking for a BI Analyst who is responsible for processing data, developing reports and extracting actionable intelligence. He or she will work closely with the Business & Finance to build & optimize reports, & make drive informed / actionable insight to change the business trajectory. The ability to recognize and understand trends, collaborate with cross-functional teams and solve complex problems are key to success within this role.Responsibilities:* Collaborate with Senior Management to understand business intelligence needs, translating strategic business questions into resource/data requirements* Own the design, development, and maintenance of ongoing metrics, reports, analyses, dashboards, etc. to drive key business decisions* Take dashboard requirements and transfer into rapidly developed prototypes and working solutions* Write Extract-Transform-Load (ETL) jobs to calculate business metrics* Own & manage Venmo's BI tool & relationship with the 3p provider* Develop detailed data mapping and end-to-end process flows* Remain detail-oriented while working across a wide variety of projects* Collaborate with Data Analytics and Data Warehouse around data and table structures to optimize for KPI reporting* Be part of a great team, but be capable of operating independently - managing relationships, deliverables and expectations with your business partnersQualifications:* Bachelor's degree in Computer Science, Mathematics, Statistics, Finance, or equivalent work experience* 3+ years of relevant work experience in analytics, data engineering, business intelligence or related field* Experience using, writing and optimizing SQL queries in a business environment* Experience in business intelligence software (Tableau, Looker, Qlikview, MicroStrategy) and ETL software* Knowledge of data warehouse technical architecture, infrastructure components, ETL and reporting/analytic tools and environmentsPreferred qualifications:* 5+ years of experience using Looker* 5+ years of experience in data visualization* Expert in data extraction using SQL* Strong analytical, problem solving and critical thinking paired with Intellectual curiosity and aptitude in picking up new technical skills* Ability to execute fast-paced and dynamic projects in a highly organized manner on a tight schedule* Work collaboratively across different functions and effectively influence senior business partners* Degree in Computer Science, IT, Math, Physics, Statistics, Engineering or quantitative field* Proficient with SQL(Postgres, MySQL, Redshift, Snowflake), Python* 3+ years of relevant work experience in analytics, data engineering, business intelligence or related field* Strong communication and presentation skills necessary to build effective working relationships and positively influence decision making* Strong business acumen* Coding proficiency Python* Experience with AWS technologies including Redshift, RDS, S3, EMRWe know the confidence gap and imposter syndrome can get in the way of meeting spectacular candidates. Please don't hesitate to apply.",Financial Transaction Processing,Finance,Finance,about usvenmo was founded on the principles of breaking down the intimidating barriers around financial transactions to make them intuitive friendly and even fun and it worked people love sending money with venmo and we re growing by leaps and bounds but we re only just getting started we want to take that magic of sending money with venmo and cascade it into every place where people use money that means connecting people to their money in the most intuitive and fun way possible then connecting people with each other users already love venmo but we know there are lots of things we haven t thought of to make the experience of using venmo even more delightful and valuable all that s going to take a lot of figuring out let s figure it out together business intelligence at venmowe are looking for a bi analyst who is responsible for processing data developing reports and extracting actionable intelligence he or she will work closely with the business finance to build optimize reports make drive informed actionable insight to change the business trajectory the ability to recognize and understand trends collaborate with cross functional teams and solve complex problems are key to success within this role responsibilities collaborate with senior management to understand business intelligence needs translating strategic business questions into resource data requirements own the design development and maintenance of ongoing metrics reports analyses dashboards etc to drive key business decisions take dashboard requirements and transfer into rapidly developed prototypes and working solutions write extract transform load etl jobs to calculate business metrics own manage venmo s bi tool relationship with the 3p provider develop detailed data mapping and end to end process flows remain detail oriented while working across a wide variety of projects collaborate with data analytics and data warehouse around data and table structures to optimize for kpi reporting be part of a great team but be capable of operating independently managing relationships deliverables and expectations with your business partnersqualifications bachelor s degree in computer science mathematics statistics finance or equivalent work experience 3 years of relevant work experience in analytics data engineering business intelligence or related field experience using writing and optimizing sql queries in a business environment experience in business intelligence software tableau looker qlikview microstrategy and etl software knowledge of data warehouse technical architecture infrastructure components etl and reporting analytic tools and environmentspreferred qualifications 5 years of experience using looker 5 years of experience in data visualization expert in data extraction using sql strong analytical problem solving and critical thinking paired with intellectual curiosity and aptitude in picking up new technical skills ability to execute fast paced and dynamic projects in a highly organized manner on a tight schedule work collaboratively across different functions and effectively influence senior business partners degree in computer science it math physics statistics engineering or quantitative field proficient with sql postgres mysql redshift snowflake python 3 years of relevant work experience in analytics data engineering business intelligence or related field strong communication and presentation skills necessary to build effective working relationships and positively influence decision making strong business acumen coding proficiency python experience with aws technologies including redshift rds s3 emrwe know the confidence gap and imposter syndrome can get in the way of meeting spectacular candidates please don t hesitate to apply
20,Business Analyst - CRM,"CRM & Analytics Team Overview:The CRM & Analytics team is a highly strategic and cross-functional team responsible for leading the firm's global digitalization effort. This initiative, spanning all client-facing business units and corporate functions, will drive innovation and strategic change through technology, data science, and deep analytics. The team partners with key business leaders and industry experts to build transformational technology to drive revenue, maximize efficiency, and optimize the allocation of resources. The CRM & Analytics team is at the forefront of Jefferies' cloud initiative, leveraging best-in-class cloud-based technologies to replace legacy on-premises solutions to provide intelligent trend insights, actionable opportunities, decision support, and transparency into all client and business-related activities.Position Overview:Business Analysts are responsible for conducting business analysis and documenting business requirements. They will work closely with end users, product managers, UX and other technology partners to develop designs for implementation. Responsibilities include:Analyze and decompose current state business processesDefine target state business processes and align functional solutionsDocument process flow diagrams, business/functional requirements and user storiesInformation gathering activities such as surveying, analyzing and evaluating processes, products and services, by using a variety of internal and/or external dataAssist with all phases of SDLC with emphasis on requirements, UAT and Change ManagementAssist in coordinating business unit subject matter expert meetings in order to solicit and cross-reference business and functional requirementsHelp ensure project team is adhering to project plans and helping to identify and resolve discrepanciesRequirements:3 years in a large organization or major consulting organization focused on a Business Analysis within the Equity, Fixed Income or Investment Banking businessesKeen interest in learning new process and technologiesInquisitive and continuously focused on identifying inefficiencies and improving business processesThorough documentation skillsExcellent interpersonal skills and ability to thrive in a collaborative environmentGoal-orientated, self-motivated and adapts to changing situationsStrong organizational and analytical skills; must be detail orientatedSalesforce or Tier1 knowledge",Investment Banking & Asset Management,Finance,Finance,crm analytics team overview the crm analytics team is a highly strategic and cross functional team responsible for leading the firm s global digitalization effort this initiative spanning all client facing business units and corporate functions will drive innovation and strategic change through technology data science and deep analytics the team partners with key business leaders and industry experts to build transformational technology to drive revenue maximize efficiency and optimize the allocation of resources the crm analytics team is at the forefront of jefferies cloud initiative leveraging best in class cloud based technologies to replace legacy on premises solutions to provide intelligent trend insights actionable opportunities decision support and transparency into all client and business related activities position overview business analysts are responsible for conducting business analysis and documenting business requirements they will work closely with end users product managers ux and other technology partners to develop designs for implementation responsibilities include analyze and decompose current state business processesdefine target state business processes and align functional solutionsdocument process flow diagrams business functional requirements and user storiesinformation gathering activities such as surveying analyzing and evaluating processes products and services by using a variety of internal and or external dataassist with all phases of sdlc with emphasis on requirements uat and change managementassist in coordinating business unit subject matter expert meetings in order to solicit and cross reference business and functional requirementshelp ensure project team is adhering to project plans and helping to identify and resolve discrepanciesrequirements 3 years in a large organization or major consulting organization focused on a business analysis within the equity fixed income or investment banking businesseskeen interest in learning new process and technologiesinquisitive and continuously focused on identifying inefficiencies and improving business processesthorough documentation skillsexcellent interpersonal skills and ability to thrive in a collaborative environmentgoal orientated self motivated and adapts to changing situationsstrong organizational and analytical skills must be detail orientatedsalesforce or tier1 knowledge
