,Job_Title,Job_Description,Industry,Sector,target,clean_text
63,TGS Central Teams Business Partner - Supply Chain Planning Lead,"Job Description Summary
The role of the Supply Chain Planning Business Partner lead is to serve as the TGS representative responsible for partnering with the Integrated Supply Chain Planning Organization. This role is responsible for driving and shaping demand as well as ensuring the delivery of Technology & Global Services (TGS) solutions for the Integrated Supply Chain Planning function, globally.

This individual will serve as a point person to the Supply Chain Planning leadership team and will lead a team of business analysts that will conduct solution and business process analysis and prepare the appropriate solution direction and manage the delivery of the technology work, for this function.

This individual will be required to collaborate with internal and external stakeholders to ensure that the Supply Chain Planning function is proactively provided with strategic thought leadership and that demand is shaped, prioritized, and delivered.

This is a great opportunity for someone to facilitate bringing the appropriate technology, process and workplace solutions together as they contribute to the Supply Chain Planning agenda of BD.

This leadership position reports directly to the TGS Central Teams Business Partner for the Integrated Supply Chain and will serve on the leadership teams of both the TGS Central Team Integrated Supply Chain (ISC) team and the Supply Chain Planning leadership team.
Job Description


The objective of this role is to actively partner with the Integrated Supply Chain Planning Leadership team to understand their strategic priorities and work to identify ways that TGS can support and advance those objectives. Primary responsibilities will include:
Developing a deep knowledge of BDs Supply Chain Planning environment, including key driver goals, short- and long-term road-maps, key personnel, etc.
Establish and earn value-adding, strategic partner relationship maturity for yourself and for the entire TGS function
Partner with the Integrated Supply Chain leadership to plan new joint initiatives, evaluate proposals, and determine how they fit into road-maps and priorities
Identify and define new opportunities to leverage technology and/or process re-design to advance business strategies that directly contribute to driving revenue growth, cost optimization and/or risk mitigation and compliance.
Develop strategies for optimal deployment and adoption of new technology capabilities, services and solutions across the business and/or the end-customers.
Manage and facilitate TGS partner teams to ensure delivery provides the desired outcomes
Partner with Segments, Regions and Central Business Partners to integrate Supply Chain Planning initiatives across the enterprise to accelerate BDX
Work with other TGS Business Partners and TGS Core Areas of Delivery to ensure that solutions are not siloed and that they are informed by, and are integrated with, BDs enterprise road-maps
Ensure projects and initiatives are delivered, providing consistent and effective communication on status and managing escalation and avoiding risk.
Build Knowledge and capability in Supply Chain Planning technologies and processes in emerging as well as improvements to existing investments by keeping abreast of industry trends and Subject matter expertise in usage of new trends such as AI and ML in the context of planning.
Measure and communicate value realized on a periodic basis through defined and agreed upon metrics and supporting analysis.
Serve as a continuous connector. Energized by a role that is focused on partnership and facilitation. Operates through the lens of what can we do to simplify and improve things.
Primary Work Location
USA NJ - Franklin Lakes
Additional Locations
Work Shift
NA (United States of America)",Health Care Products Manufacturing,Manufacturing,Manufacturing,job description summary the role of the supply chain planning business partner lead is to serve as the tgs representative responsible for partnering with the integrated supply chain planning organization this role is responsible for driving and shaping demand as well as ensuring the delivery of technology global services tgs solutions for the integrated supply chain planning function globally this individual will serve as a point person to the supply chain planning leadership team and will lead a team of business analysts that will conduct solution and business process analysis and prepare the appropriate solution direction and manage the delivery of the technology work for this function this individual will be required to collaborate with internal and external stakeholders to ensure that the supply chain planning function is proactively provided with strategic thought leadership and that demand is shaped prioritized and delivered this is a great opportunity for someone to facilitate bringing the appropriate technology process and workplace solutions together as they contribute to the supply chain planning agenda of bd this leadership position reports directly to the tgs central teams business partner for the integrated supply chain and will serve on the leadership teams of both the tgs central team integrated supply chain isc team and the supply chain planning leadership team job description the objective of this role is to actively partner with the integrated supply chain planning leadership team to understand their strategic priorities and work to identify ways that tgs can support and advance those objectives primary responsibilities will include developing a deep knowledge of bds supply chain planning environment including key driver goals short and long term road maps key personnel etc establish and earn value adding strategic partner relationship maturity for yourself and for the entire tgs function partner with the integrated supply chain leadership to plan new joint initiatives evaluate proposals and determine how they fit into road maps and priorities identify and define new opportunities to leverage technology and or process re design to advance business strategies that directly contribute to driving revenue growth cost optimization and or risk mitigation and compliance develop strategies for optimal deployment and adoption of new technology capabilities services and solutions across the business and or the end customers manage and facilitate tgs partner teams to ensure delivery provides the desired outcomes partner with segments regions and central business partners to integrate supply chain planning initiatives across the enterprise to accelerate bdx work with other tgs business partners and tgs core areas of delivery to ensure that solutions are not siloed and that they are informed by and are integrated with bds enterprise road maps ensure projects and initiatives are delivered providing consistent and effective communication on status and managing escalation and avoiding risk build knowledge and capability in supply chain planning technologies and processes in emerging as well as improvements to existing investments by keeping abreast of industry trends and subject matter expertise in usage of new trends such as ai and ml in the context of planning measure and communicate value realized on a periodic basis through defined and agreed upon metrics and supporting analysis serve as a continuous connector energized by a role that is focused on partnership and facilitation operates through the lens of what can we do to simplify and improve things primary work location usa nj franklin lakes additional locations work shift na united states of america
65,Business Analyst,"FHIR
Agile Äì Scrum
Epic/Userstory/ETC
Balsamiq/wireframing
Healthcare
Jira/Conflunce/Other tools
Desired Skills:
CSPO would be a plus
Responsibilities:
The role requires 4 to 12 years of relevant work experience
Managing and analyzing business requirements with the ability to prioritize during changes and conflicts
Independently facilitating user groups to drive consensus
Ability to write detailed descriptions and analysis of user needs business impacts and systems functionality for software development life cycle
Providing and reviewing estimates at the project level
Ability to work independently and share learnings with fellow colleagues
Understanding the project schedule and plan/prioritize work schedule for a team to meet time deadlines consistently
Delivering all assigned tasks on time/ahead of time with expected quality and within budget Constraints
Taking ownership of projects assigned with successful deliveries and recognize and escalate situations as deemed necessary",Staffing & Outsourcing,Business Services,Business Services,fhir agile äì scrum epic userstory etc balsamiq wireframing healthcare jira conflunce other tools desired skills cspo would be a plus responsibilities the role requires 4 to 12 years of relevant work experience managing and analyzing business requirements with the ability to prioritize during changes and conflicts independently facilitating user groups to drive consensus ability to write detailed descriptions and analysis of user needs business impacts and systems functionality for software development life cycle providing and reviewing estimates at the project level ability to work independently and share learnings with fellow colleagues understanding the project schedule and plan prioritize work schedule for a team to meet time deadlines consistently delivering all assigned tasks on time ahead of time with expected quality and within budget constraints taking ownership of projects assigned with successful deliveries and recognize and escalate situations as deemed necessary
66,Business Analyst,"It's an incredible time for our industry and specifically the Automation Acceleration team. The demand for automation is ever growing with requirements from Regulators to perform frequent disaster recovery tests and Sustained Resiliency events. To create a more stable production environment we need to automate various tasks like deployments, health checks, server patching and failovers etc.Primarily you will be focused on:* Reviewing and advising on various tools/frameworks available for automation* Partnering with groups to define requirements, develop solutions and drive rollout / adoption* Pilot new tools/frameworks and perform feasibility study through proof of concept and also help senior management to take decision on strategic tool/framework* Contribute in developing useful code snippets and frameworks to reduce the adoption time.* Influence senior management and application teams' automation strategiesQualifications:* Bachelor's degree in computer science or related area* 10+ years of project experience across a broad array of technologies with expertise in more than one technology area* 5+ years developing and/or architecting large, high volume systems* Proven knowledge of J2EE and one or more development languages (e.g. Java/JQuery, Javascript, Python/Jython, Perl, Ruby, Groovy, C++/C#, .Net, VBScript, SQL and Ansible etc.)* Hands on experience in API and web service development* Hands on with Continuous Integration and Continues Delivery automation tools/frameworks (e.g. Cucumber, Selenium Grid, Junit, Jenkins and JIRA, etc.)* Working experience with platforms/OS/Servers (e.g. Windows Server, Linux/Unix, J2EE, IIS, Apache, Tomcat, etc.)* Must have working experience w/ relational databases, infrastructure design and resiliency, security and performance tuning* Experience in agile and Kanban development practicesJPMorgan Chase & Co., one of the oldest financial institutions, offers innovative financial solutions to millions of consumers, small businesses and many of the world's most prominent corporate, institutional and government clients under the J.P. Morgan and Chase brands. Our history spans over 200 years and today we are a leader in investment banking, consumer and small business banking, commercial banking, financial transaction processing and asset management.We recognize that our people are our strength and the diverse talents they bring to our global workforce are directly linked to our success. We are an equal opportunity employer and place a high value on diversity and inclusion at our company. We do not discriminate on the basis of any protected attribute, including race, religion, color, national origin, gender, sexual orientation, gender identity, gender expression, age, marital or veteran status, pregnancy or disability, or any other basis protected under applicable law. In accordance with applicable law, we make reasonable accommodations for applicants' and employees' religious practices and beliefs, as well as any mental health or physical disability needs.Equal Opportunity Employer/Disability/Veterans",Investment Banking & Asset Management,Finance,Finance,it s an incredible time for our industry and specifically the automation acceleration team the demand for automation is ever growing with requirements from regulators to perform frequent disaster recovery tests and sustained resiliency events to create a more stable production environment we need to automate various tasks like deployments health checks server patching and failovers etc primarily you will be focused on reviewing and advising on various tools frameworks available for automation partnering with groups to define requirements develop solutions and drive rollout adoption pilot new tools frameworks and perform feasibility study through proof of concept and also help senior management to take decision on strategic tool framework contribute in developing useful code snippets and frameworks to reduce the adoption time influence senior management and application teams automation strategiesqualifications bachelor s degree in computer science or related area 10 years of project experience across a broad array of technologies with expertise in more than one technology area 5 years developing and or architecting large high volume systems proven knowledge of j2ee and one or more development languages e g java jquery javascript python jython perl ruby groovy c c net vbscript sql and ansible etc hands on experience in api and web service development hands on with continuous integration and continues delivery automation tools frameworks e g cucumber selenium grid junit jenkins and jira etc working experience with platforms os servers e g windows server linux unix j2ee iis apache tomcat etc must have working experience w relational databases infrastructure design and resiliency security and performance tuning experience in agile and kanban development practicesjpmorgan chase co one of the oldest financial institutions offers innovative financial solutions to millions of consumers small businesses and many of the world s most prominent corporate institutional and government clients under the j p morgan and chase brands our history spans over 200 years and today we are a leader in investment banking consumer and small business banking commercial banking financial transaction processing and asset management we recognize that our people are our strength and the diverse talents they bring to our global workforce are directly linked to our success we are an equal opportunity employer and place a high value on diversity and inclusion at our company we do not discriminate on the basis of any protected attribute including race religion color national origin gender sexual orientation gender identity gender expression age marital or veteran status pregnancy or disability or any other basis protected under applicable law in accordance with applicable law we make reasonable accommodations for applicants and employees religious practices and beliefs as well as any mental health or physical disability needs equal opportunity employer disability veterans
67,Business Analyst,"Skill (Primary):Business Analyst

Job Description :

To create| assign and track the project [module] work plans for delivery and also provide technical guidance for work completion. (1.) To understand the business requirements and map it to functional specifications. (2.) Suggest design solutions (3.) To participate and facilitate the walkthrough' to brief the Functional Specification mapping to Business Requirements. (4.) To prepare the functional specification document and ensure for completeness and storage. (5.) To prepare and / or aid the preparation of test cases in line with functional requirements

?Ç
Please send resumes to?Çsgottumukkula@esharpedge.com

?Ç

?Ç",Publishing,Media,Media,skill primary business analyst job description to create assign and track the project module work plans for delivery and also provide technical guidance for work completion 1 to understand the business requirements and map it to functional specifications 2 suggest design solutions 3 to participate and facilitate the walkthrough to brief the functional specification mapping to business requirements 4 to prepare the functional specification document and ensure for completeness and storage 5 to prepare and or aid the preparation of test cases in line with functional requirements ç please send resumes to çsgottumukkula esharpedge com ç ç
68,Business Analyst,"Job DescriptionWe're adding to our diverse team of experts and are looking to hire those who are committed to building a culture that enables the creation of innovative solutions for our business units and clients.The Insurance OperationsMunich Re US has launched a new insurance operations described as Munich Re Specialty Insurance (MRSI) that unites the strengths and expertise of Munich Re's specialty commercial teams in North America. This allows for the development of an overarching sales strategy through which the specialty risk appetite and product offerings can be profitably optimized and expanded.As a member of Munich Re's US operations, we offer the financial strength and stability that comes with being part of the world's preeminent insurance and reinsurance brand. Our risk experts work together to assemble the right mix of products and services to help our clients stay competitive - from traditional reinsurance coverages, to niche and specialty reinsurance and insurance products.The OpportunityFuture focused and always one step aheadThe Business Analyst is a self-starting role that will support a portfolio of change management initiatives across the various business units within the organization. As the link between business functions and IT, these individuals will be accountable for evaluating and understanding existing processes to provide solutions that ensure realization of business value.In this position you will:* Manage business partner expectations by leading the analysis of business and IT requirements across the organization's value chain.* Evaluate information and data gathered from multiple sources, identify impacts and decompose high-level information into details.* Facilitate business model design sessions with SMEs and document existing and future procedures, systems, and workflows.* Work with product owners to drive the alignment, assessment, and prioritization of identified demands within the respective business change.* Collaborate with Product Owner to define and manage project scope, anticipating issues while proactively recommending solutions.* Work with business and technical partners to design digital flow for application implementations.* Document business requirements / user stories and support population and curation of the platform backlog.* Prepare release notes, help test functionality including development of test cases for UAT and business training.* Support business platform questions and issues as well as raise system bugs and work with technical teams to resolve.Your profileQualifications:Successful candidates will possess the following experience/skills/capabilities:* Bachelor's degree* 5+ years experience in Business Process and IT Systems Analysis including requirements definition* Strong attention to detail with the ability to provide data-driven recommendations* Able to manage their time successfully to deliver the desired outcome without heavy oversight* Excellent written & oral communication, presentation, and stakeholder management skills* Experience in meeting operational deadlines in a fast-paced environment and capable of working independently or in teams* Knowledge of insurance policy administration, policy lifecycles, and workflows a plus* Experience writing user stories and working within an agile operating model* Expertise in a variety of Business Analyst methodologies, tools, and techniques.About usFounded in 1917, Munich Reinsurance America, Inc. is one of the largest reinsurers in the United States. Munich Reinsurance America, Inc. has earned the A+ (Superior) financial strength rating from A.M. Best Company - that's among the highest in the industry. Over 1,000 employees serve our clients from our Princeton, New Jersey campus and regional offices throughout the United States.As a member of Munich Re's US operations, we offer the financial strength and stability that comes with being part of the world's preeminent insurance and reinsurance brand. Our risk experts work together to assemble the right mix of products and services to help you stay competitive - from traditional reinsurance coverages, to niche and specialty reinsurance and insurance products.",Insurance Carriers,Insurance,Insurance,job descriptionwe re adding to our diverse team of experts and are looking to hire those who are committed to building a culture that enables the creation of innovative solutions for our business units and clients the insurance operationsmunich re us has launched a new insurance operations described as munich re specialty insurance mrsi that unites the strengths and expertise of munich re s specialty commercial teams in north america this allows for the development of an overarching sales strategy through which the specialty risk appetite and product offerings can be profitably optimized and expanded as a member of munich re s us operations we offer the financial strength and stability that comes with being part of the world s preeminent insurance and reinsurance brand our risk experts work together to assemble the right mix of products and services to help our clients stay competitive from traditional reinsurance coverages to niche and specialty reinsurance and insurance products the opportunityfuture focused and always one step aheadthe business analyst is a self starting role that will support a portfolio of change management initiatives across the various business units within the organization as the link between business functions and it these individuals will be accountable for evaluating and understanding existing processes to provide solutions that ensure realization of business value in this position you will manage business partner expectations by leading the analysis of business and it requirements across the organization s value chain evaluate information and data gathered from multiple sources identify impacts and decompose high level information into details facilitate business model design sessions with smes and document existing and future procedures systems and workflows work with product owners to drive the alignment assessment and prioritization of identified demands within the respective business change collaborate with product owner to define and manage project scope anticipating issues while proactively recommending solutions work with business and technical partners to design digital flow for application implementations document business requirements user stories and support population and curation of the platform backlog prepare release notes help test functionality including development of test cases for uat and business training support business platform questions and issues as well as raise system bugs and work with technical teams to resolve your profilequalifications successful candidates will possess the following experience skills capabilities bachelor s degree 5 years experience in business process and it systems analysis including requirements definition strong attention to detail with the ability to provide data driven recommendations able to manage their time successfully to deliver the desired outcome without heavy oversight excellent written oral communication presentation and stakeholder management skills experience in meeting operational deadlines in a fast paced environment and capable of working independently or in teams knowledge of insurance policy administration policy lifecycles and workflows a plus experience writing user stories and working within an agile operating model expertise in a variety of business analyst methodologies tools and techniques about usfounded in 1917 munich reinsurance america inc is one of the largest reinsurers in the united states munich reinsurance america inc has earned the a superior financial strength rating from a m best company that s among the highest in the industry over 1 000 employees serve our clients from our princeton new jersey campus and regional offices throughout the united states as a member of munich re s us operations we offer the financial strength and stability that comes with being part of the world s preeminent insurance and reinsurance brand our risk experts work together to assemble the right mix of products and services to help you stay competitive from traditional reinsurance coverages to niche and specialty reinsurance and insurance products
